{"schema_version":"1.0.0","protocol_version":"1.2","receipt_id":"receipt-1","candidate_id":"candidate-1","revision_hash":"aaaaaaaaaaaaaaaaaaaaaaaaaaaaaaaaaaaaaaaaaaaaaaaaaaaaaaaaaaaaaaaa","correlation_id":"review-1","idempotency_key":"promotion-1","agent_hash":"0123456789abcdef","action":"promote","timestamp":"2026-09-15T00:00:00Z","evidence_hashes":["evaluation-1"],"snapshot_hash":null,"reason":"guarded policy passed"}
